244,Chuck Norris got his drivers license at the age of 16. Seconds.
245,The original title for Alien vs. Predator was Alien and Predator vs Chuck Norris. The film was cancelled shortly after going into preproduction. No one would pay nine dollars to see a movie fourteen seconds long.
246,"Chuck Norris? sperm is so badass, he had sex with Nicole Kidman, and 7 months later she prematurely gave birth to a Ford Excursion."
247,Chuck Norris can win at solitaire with only 18 cards.
248,"Chuck Norris once shat blood - the blood of 11,940 natives he had killed and eaten."
249,Maslow's theory of higher needs does not apply to Chuck Norris. He only has two needs: killing people and finding people to kill.
250,"The truth will set you free. Unless Chuck Norris has you, in which case, forget it buddy!"
251,Kryptonite has been found to contain trace elements of Chuck Norris roundhouse kicks to the face. This is why it is so deadly to Superman.
252,"Saddam Hussein was not found hiding in a ""hole."" Saddam was roundhouse-kicked in the head by Chuck Norris in Kansas, which sent him through the earth, stopping just short of the surface of Iraq."
253,"Coroners refer to dead people as ""ABC's"". Already Been Chucked."
254,Chuck Norris doesn't look both ways before he crosses the street... he just roundhouses any cars that get too close.
255,Chuck Norris does not have to answer the phone. His beard picks up the incoming electrical impulses and translates them into audible sound.
256,How many roundhouse kicks does it take to get to the center of a tootsie pop? Just one. From Chuck Norris.
257,"Chuck Norris doesnt wear a watch, HE decides what time it is."
258,"The phrase 'break a leg' was originally coined by Chuck Norris's co-stars in Walker, Texas Ranger as a good luck charm, indicating that a broken leg might be the worst extent of their injuries. This never proved to be the case."
259,"When Chuck Norris does division, there are no remainders."
260,"If you rearrange the letters in ""Chuck Norris"", they also spell ""Crush Rock In"". The words ""with his fists"" are understood."
261,"Never look a gift Chuck Norris in the mouth, because he will bite your damn eyes off."
262,"Chuck Norris used to play baseball. When Babe Ruth was hailed as the better player, Chuck Norris killed him with a baseball bat to the throat. Lou Gehrig got off easy."
263,"The original title for Star Wars was ""Skywalker: Texas Ranger"". Starring Chuck Norris."
264,"Guantuanamo Bay, Cuba, is the military code-word for ""Chuck Norris' basement""."
265,The phrase 'balls to the wall' was originally conceived to describe Chuck Norris entering any building smaller than an aircraft hangar.
266,"Chuck Norris? roundhouse kick is so powerful, it can be seen from outer space by the naked eye."
267,Ozzy Osbourne bites the heads off of bats. Chuck Norris bites the heads off of Siberian Tigers.
268,"He who lives by the sword, dies by the sword. He who lives by Chuck Norris, dies by the roundhouse kick."
269,The best-laid plans of mice and men often go awry. Even the worst-laid plans of Chuck Norris come off without a hitch.
270,The phrase 'dead ringer' refers to someone who sits behind Chuck Norris in a movie theater and forgets to turn their cell phone off.
271,"Staring at Chuck Norris for extended periods of time without proper eye protection will cause blindess, and possibly foot sized brusies on the face."
272,Chuck Norris can taste lies.
273,"Chuck Norris does not kick ass and take names. In fact, Chuck Norris kicks ass and assigns the corpse a number. It is currently recorded to be in the billions."
274,"One time, Chuck Norris accidentally stubbed his toe. It destroyed the entire state of Ohio."
275,"Little Miss Muffet sat on her tuffet, until Chuck Norris roundhouse kicked her into a glacier."
277,Chuck Norris can blow bubbles with beef jerky.
278,"They had to edit the first ending of 'Lone Wolf McQuade' after Chuck Norris kicked David Carradine's ass, then proceeded to barbecue and eat him."
279,"Chuck Norris does, in fact, live in a round house."
280,"When Chuck Norris works out on the Total Gym, the Total Gym feels like it's been raped."
281,"4 out of 5 doctors fail to recommend Chuck Norris as a solution to most problems. Also, 80% of doctors die unexplained, needlessly brutal deaths."
282,Chuck Norris can skeletize a cow in two minutes.
283,"The only sure things are Death and Taxes?and when Chuck Norris goes to work for the IRS, they'll be the same thing."
284,Chuck Norris' first job was as a paperboy. There were no survivors.
285,"With the rising cost of gasoline, Chuck Norris is beginning to worry about his drinking habit."
286,"The square root of Chuck Norris is pain. Do not try to square Chuck Norris, the result is death."
287,Chuck Norris' testicles do not produce sperm. They produce tiny white ninjas that recognize only one mission: seek and destroy.
288,To be or not to be? That is the question. The answer? Chuck Norris.
289,"Chuck Norris has never been in a fight, ever. Do you call one roundhouse kick to the face a fight?"
290,"There are two types of people in the world... people that suck, and Chuck Norris."
291,Chuck Norris never wet his bed as a child. The bed wet itself out of fear.
292,"If you were somehow able to land a punch on Chuck Norris your entire arm would shatter upon impact. This is only in theory, since, come on, who in their right mind would try this?"
293,70% of a human's weight is water. 70% of Chuck Norris' weight is his dick.
294,Jean-Claude Van Damme once kicked Chuck Norris' ass. He was then awakened from his dream by a roundhouse kick to the face.
295,"The pie scene in ""American Pie"" is based on a dare Chuck Norris took when he was younger. However, in Chuck Norris' case, the ""pie"" was the molten crater of an active volcano."
296,Chuck Norris uses 8'x10' sheets of plywood as toilet paper.
297,Noah was the only man notified before Chuck Norris relieved himself in the Atlantic Ocean.
298,"MacGyver immediately tried to make a bomb out of some Q-Tips and Gatorade, but Chuck Norris roundhouse-kicked him in the solar plexus. MacGyver promptly threw up his own heart."
299,"Jack Bauer tried to use his detailed knowledge of torture techniques, but to no avail: Chuck Norris thrives on pain. Chuck Norris then ripped off Jack Bauer's arm and beat him to death with it. Game, set, match."
300,Chuck Norris eats steak for every single meal. Most times he forgets to kill the cow.
301,The First Law of Thermodynamics states that energy can neither be created nor destroyed... unless it meets Chuck Norris.
302,"Chuck Norris doesn't go on the internet, he has every internet site stored in his memory. He refreshes webpages by blinking."
303,Fact: Chuck Norris doesn't consider it sex if the woman survives.
304,"It is said that looking into Chuck Norris' eyes will reveal your future. Unfortunately, everybody's future is always the same: death by a roundhouse-kick to the face."
305,Chuck Norris knows everything there is to know - Except for the definition of mercy.
306,"Scientifically speaking, it is impossible to charge Chuck Norris with ""obstruction of justice."" This is because even Chuck Norris cannot be in two places at the same time."
307,Chuck Norris never has to wax his skis because they're always slick with blood.
308,"When you say ""no one's perfect"", Chuck Norris takes this as a personal insult."
309,"Chuck Norris can win a game of Trivial Pursuit with one roll of the dice, and without answering a single question... just a nod of the head, and a stroke of the beard."
310,"182,000 Americans die from Chuck Norris-related accidents every year."
311,"Paper beats rock, rock beats scissors, and scissors beats paper, but Chuck Norris beats all 3 at the same time."
312,"Jesus can walk on water, but Chuck Norris can walk on Jesus."
313,"All roads lead to Chuck Norris. And by the transitive property, a roundhouse kick to the face."
314,July 4th is Independence day. And the day Chuck Norris was born. Coincidence? I think not.
315,Chuck Norris never goes to the dentist because his teeth are unbreakable. His enemies never go to the dentist because they have no teeth.
316,"In the medical community, death is referred to as ""Chuck Norris Disease"""
317,"Chuck Norris was once in a knife fight, and the knife lost."
318,"If you work in an office with Chuck Norris, don't ask him for his three-hole-punch."
319,"In the Words of Julius Caesar, ""Veni, Vidi, Vici, Chuck Norris"". Translation: I came, I saw, and I was roundhouse-kicked inthe face by Chuck Norris."
320,The First rule of Chuck Norris is: you do not talk about Chuck Norris.
321,"Chuck Norris is widely predicted to be first black president. If you're thinking to yourself, ""But Chuck Norris isn't black"", then you are dead wrong. And stop being a racist."
322,"When Chuck Norris plays Monopoly, it affects the actual world economy."
323,Chuck Norris can be unlocked on the hardest level of Tekken. But only Chuck Norris is skilled enough to unlock himself. Then he roundhouse kicks the Playstation back to Japan.
324,Chuck Norris drinks napalm to quell his heartburn.
325,"Every time someone uses the word ""intense"", Chuck Norris always replies ""you know what else is intense?"" followed by a roundhouse kick to the face."
326,"As an infant, Chuck Norris' parents gave him a toy hammer. He gave the world Stonehenge."
327,Chuck Norris once ordered a steak in a restaurant. The steak did what it was told.
328,"Most people fear the Reaper. Chuck Norris considers him ""a promising Rookie""."
329,"There are only two things that can cut diamonds: other diamonds, and Chuck Norris."
330,President Roosevelt once rode his horse 100 miles. Chuck Norris carried his the same distance in half the time.
331,Chuck Norris once ate four 30lb bowling balls without chewing.
332,What many people dont know is Chuck Norris is the founder of planned parenthood. Not even unborn children can escape his wrath.
333,"Chuck Norris was banned from competitive bullriding after a 1992 exhibition in San Antonio, when he rode the bull 1,346 miles from Texas to Milwaukee Wisconsin to pick up his dry cleaning."
334,"Chuck Norris qualified with a top speed of 324 mph at the Daytona 500, without a car."
335,"Chuck Norris likes his coffee half and half: half coffee grounds, half wood-grain alcohol."
336,Chuck Norris uses tabasco sauce instead of visine.
337,The chemical formula for the highly toxic cyanide ion is CN-. These are also Chuck Norris' initials. This is not a coincidence.
338,"Chuck Norris' credit cards have no limit. Last weekend, he maxed them out."
339,Think of a hot woman. Chuck Norris did her.
340,"A man once claimed Chuck Norris kicked his ass twice, but it was promptly dismissed as false - no one could survive it the first time."
341,Chuck Norris sleeps with a pillow under his gun.
342,Chuck Norris owns a chain of fast-food restaurants throughout the southwest. They serve nothing but barbecue-flavored ice cream and Hot Pockets.
343,Chuck Norris doesn't chew gum. Chuck Norris chews tin foil.
344,Aliens DO indeed exist. They just know better than to visit a planet that Chuck Norris is on.
345,"When in a bar, you can order a drink called a ""Chuck Norris"". It is also known as a ""Bloody Mary"", if your name happens to be Mary."
346,"Every time Chuck Norris smiles, someone dies. Unless he smiles while he?s roundhouse kicking someone in the face. Then two people die."
347,"Some people ask for a Kleenex when they sneeze, Chuck Norris asks for a body bag."
348,"There?s an order to the universe: space, time, Chuck Norris.... Just kidding, Chuck Norris is first."
349,"A man once asked Chuck Norris if his real name is ""Charles"". Chuck Norris did not respond, he simply stared at him until he exploded."
350,"Chuck Norris starts everyday with a protein shake made from Carnation Instant Breakfast, one dozen eggs, pure Colombian cocaine, and rattlesnake venom. He injects it directly into his neck with a syringe."
351,"In a tagteam match, Chuck Norris was teamed with Hulk Hogan against King Kong Bundy and Andre The Giant. He pinned all 3 at the same time."
352,Chuck Norris doesn't see dead people. He makes people dead.
353,"Chuck Norris is the only person who can simultaneously hold and fire FIVE Uzis: One in each hand, one in each foot -- and the 5th one he roundhouse-kicks into the air, so that it sprays bullets."
354,"For undercover police work, Chuck Norris pins his badge underneath his shirt, directly into his chest."
355,"In the X-Men movies, none of the X-Men super-powers are done with special effects. Chuck Norris is the stuntman for every character."
356,We live in an expanding universe. All of it is trying to get away from Chuck Norris.
357,"The word 'Kill' was invented by Chuck Norris. Other words were 'Die', 'Beer', and 'What'."
358,"The 11th commandment is ?Thou shalt not piss off Chuck Norris? This commandment is rarely enforced, as it is impossible to accomplish."
359,Chuck Norris is his own line at the DMV.
360,Two wrongs don't make a right. Unless you're Chuck Norris. Then two wrongs make a roundhouse kick to the face.
361,Who let the dogs out? Chuck Norris let the dogs out... and then roundhouse kicked them through an Oldsmobile.
362,"Chuck Norris can do a roundhouse kick faster than the speed of light. This means that if you turn on a light switch, you will be dead before the lightbulb turns on."
363,"When Chuck Norris goes to out to eat, he orders a whole chicken, but he only eats its soul."
365,Chuck Norris has never won an Academy Award for acting... because he's not acting.
366,"If Chuck Norris wants your opinion, he'll beat it into you."
367,Not everyone that Chuck Norris is mad at gets killed. Some get away. They are called astronauts.
368,Chuck Norris has to register every part of his body as a separate lethal weapon. His spleen is considered a concealed weapon in over 50 states.
369,"A movie scene depicting Chuck Norris losing a fight with Bruce Lee was the product of history's most expensive visual effect. When adjusted for inflation, the effect cost more than the Gross National Product of Paraguay."
370,Godzilla is a Japanese rendition of Chuck Norris' first visit to Tokyo.
371,"They once made a Chuck Norris toilet paper, but there was a problem-- It wouldn't take shit from anybody."
372,"Chuck Norris once rode a nine foot grizzly bear through an automatic car wash, instead of taking a shower."
373,"""Sweating bullets"" is literally what happens when Chuck Norris gets too hot."
374,Chuck Norris' sperm can be seen with the naked eye. Each one is the size of a quarter.
375,"After taking a steroids test doctors informed Chuck Norris that he had tested positive. He laughed upon receiving this information, and said ""of course my urine tested positive, what do you think they make steroids from?"""
376,Chuck Norris doesn't daydream. He's too busy giving other people nightmares.
377,"When Arnold says ""I'll be back"" in Terminator movie it is implied that he's going to ask Chuck Norris for help."
378,There are no such things as tornados. Chuck Norris just hates trailer parks.
379,"Chuck Norris' Penis is a third degree blackbelt, and an honorable 32nd-degree mason."
380,"Chuck Norris does not follow fashion trends, they follow him. But then he turns around and kicks their ass. Nobody follows Chuck Norris."
381,"Diamonds are not, despite popular belief, carbon. They are, in fact, Chuck Norris fecal matter. This was proven a recently, when scientific analysis revealed what appeared to be Jean-Claude Van Damme bone fragments inside the Hope Diamond."
382,Chuck Norris once participated in the running of the bulls. He walked.
383,The Drummer for Def Leppard's only got one arm. Chuck Norris needed a back scratcher.
384,Chuck Norris was the orginal sculptor of Mount Rushmore. He completed the entire project using only a bottle opener and a drywall trowel.
385,"Chuck Norris once rode a bull, and nine months later it had a calf."
386,"Chuck Norris once lost the remote, but maintained control of the TV by yelling at it in between bites of his ""Filet of Child"" sandwich."
387,"For Spring Break '05, Chuck Norris drove to Madagascar, riding a chariot pulled by two electric eels."
388,"The Manhattan Project was not intended to create nuclear weapons, it was meant to recreate the destructive power in a Chuck Norris Roundhouse Kick. They didn't even come close."
389,Chuck Norris has banned rainbows from the state of North Dakota.
390,Divide Chuck Norris by zero and you will in fact get one........one bad-ass that is.
391,TNT was originally developed by Chuck Norris to cure indigestion.
392,"After returning from World War 2 unscrathed, Bob Dole was congratulated by Chuck Norris with a handshake. The rest is history."
393,"Chuck Norris runs on batteries. Specifically, Die Hards."
394,"""Let the Bodies Hit the Floor"" was originally written as Chuck Norris' theme song."
395,Chuck Norris will never have a heart attack. His heart isn't nearly foolish enough to attack him.
396,Only Chuck Norris can prevent forest fires.
397,"When Chuck Norris makes a burrito, its main ingredient is real toes."
398,Chuck Norris is not Irish. His hair is soaked in the blood of his victims.
399,"In the movie ""The Matrix"", Chuck Norris is the Matrix. If you pay close attention in the green ""falling code"" scenes, you can make out the faint texture of his beard."
400,"Chuck Norris' dick is so big, it has it's own dick, and that dick is still bigger than yours."
401,They say curiosity killed the cat. This is false. Chuck Norris killed the cat. Every single one of them.
402,"There is no such thing as a lesbian, just a woman who has never met Chuck Norris."
403,Chuck Norris crossed the road. No one has ever dared question his motives.
404,"When Chuck Norris was born, he immediately had sex with the first nurse he saw. He was her first. She was his third. That afternoon."
405,"One time, at band camp, Chuck Norris ate a percussionist."
406,"Chuck Norris doesn't say ""who's your daddy"", because he knows the answer."
407,Chuck Norris originally wrote the first dictionary. The definition for each word is as follows - A swift roundhouse kick to the face.
408,Love does not hurt. Chuck Norris does.
409,"The term ""Cleveland Steamer"" got its name from Chuck Norris, when he took a dump while visiting the Rock and Roll Hall of fame and buried northern Ohio under a glacier of fecal matter."
410,Chuck Norris once round-house kicked a salesman. Over the phone.
411,"The pen is mighter than the sword, but only if the pen is held by Chuck Norris."
412,Chuck Norris knows the last digit of pi.
413,Those aren't credits that roll after Walker Texas Ranger. It is actually a list of fatalities that occurred during the making of the episode.
414,The air around Chuck Norris is always a balmy 78 degrees.
415,"When Chuck Norris wants an egg, he cracks open a chicken."
416,Chuck Norris plays racquetball with a waffle iron and a bowling ball.
417,"According to the Bible, God created the universe in six days. Before that, Chuck Norris created God by snapping his fingers."
418,Chuck Norris doesn't believe in ravioli. He stuffs a live turtle with beef and smothers it in pig's blood.
419,Count from one to ten. That's how long it would take Chuck Norris to kill you...Fourty seven times.
420,"The 1972 Miami Dolphins lost one game, it was a game vs. Chuck Norris and three seven year old girls. Chuck Norris won with a roundhouse-kick to the face in overtime."
421,Chuck Norris is not Politically Correct. He is just Correct. Always.
422,Mr. T pities the fool. Chuck Norris rips the fool's head off.
423,Chuck Norris had to stop washing his clothes in the ocean. The tsunamis were killing people.
424,Chuck Norris has volunteered to remain on earth after the Rapture; he will spend his time fighting the Anti-Christ.
425,Chuck Norris is the only known mammal in history to have an opposable thumb. On his penis.
426,"A man once taunted Chuck Norris with a bag of Lay's potato chips, saying ""Betcha can't eat just one!"" Chuck Norris proceeded to eat the chips, the bag, and the man in one deft move."
427,Chuck Norris' favorite cereal is Kellogg's Nails 'N' Gravel.
428,"In the first Jurassic Park movie, the Tyrannosaurus Rex wasn't chasing the jeep. Chuck Norris was chasing the Tyrannosaurus AND the jeep."
429,"Chuck Norris has never been accused of murder because his roundhouse kicks are recognized as ""acts of God."""
430,Chuck Norris does not wear a condom. Because there is no such thing as protection from Chuck Norris.
431,Rules of fighting: 1) Don't bring a knife to a gun fight. 2) Don't bring a gun to a Chuck Norris fight.
432,"Chuck Norris is the only man who has, literally, beaten the odds. With his fists."
433,"In ancient China there is a legend that one day a child will be born from a dragon, grow to be a man, and vanquish evil from the land. That man is not Chuck Norris, because Chuck Norris killed that man."
434,Chuck Norris wipes his ass with chain mail and sandpaper.
435,"When you play Monopoly with Chuck Norris, you do not pass go, and you do not collect two hundred dollars. You will be lucky if you make it out alive."
436,"Chuck Norris describes human beings as ""a sociable holder for blood and guts""."
438,Chuck Norris likes his ice like he likes his skulls: crushed.
439,"Chuck Norris can kick through all 6 degrees of separation, hitting anyone, anywhere, in the face, at any time."
440,Most tough men eat nails for breakfast. Chuck Norris does all of his grocery shopping at Home Depot.
441,"Chuck Norris did not ""lose"" his virginity, he stalked it and then destroyed it with extreme prejudice."
442,Everything King Midas touches turnes to gold. Everything Chuck Norris touches turns up dead.
448,"When Chuck Norris throws exceptions, it's across the room."
449,"All arrays Chuck Norris declares are of infinite size, because Chuck Norris knows no bounds."
450,Chuck Norris doesn't have disk latency because the hard drive knows to hurry the hell up.
451,Chuck Norris writes code that optimizes itself.
452,Chuck Norris can't test for equality because he has no equal.
453,"Chuck Norris doesn't need garbage collection because he doesn't call .Dispose(), he calls .DropKick()."
454,Chuck Norris's first program was kill -9.
455,Chuck Norris burst the dot com bubble.
456,All browsers support the hex definitions #chuck and #norris for the colors black and blue.
457,"MySpace actually isn't your space, it's Chuck's (he just lets you use it)."
458,Chuck Norris can write infinite recursion functions and have them return.
459,Chuck Norris can solve the Towers of Hanoi in one move.
460,The only pattern Chuck Norris knows is God Object.
461,Chuck Norris finished World of Warcraft.
462,Project managers never ask Chuck Norris for estimations... ever.
463,Chuck Norris doesn't use web standards as the web will conform to him.
464,"""It works on my machine"" always holds true for Chuck Norris."
465,Whiteboards are white because Chuck Norris scared them that way.
466,"Chuck Norris doesn't do Burn Down charts, he does Smack Down charts."
467,Chuck Norris can delete the Recycling Bin.
468,Chuck Norris's beard can type 140 wpm.
469,Chuck Norris can unit test entire applications with a single assert.
470,"Chuck Norris doesn't bug hunt as that signifies a probability of failure, he goes bug killing."
471,Chuck Norris's keyboard doesn't have a Ctrl key because nothing controls Chuck Norris.
472,"When Chuck Norris is web surfing websites get the message ""Warning: Internet Explorer has deemed this user to be malicious or dangerous. Proceed?""."
473,Chuck Norris can overflow your stack just by looking at it.
474,"To Chuck Norris, everything contains a vulnerability."
475,"Chuck Norris doesn't need sudo, he just types ""Chuck Norris"" before his commands."
476,"Chuck Norris doesn't need a debugger, he just stares down the bug until the code confesses."
477,Chuck Norris can access private methods.
478,Chuck Norris can instantiate an abstract class.
479,Chuck Norris does not need to know about class factory pattern. He can instantiate interfaces.
480,The class object inherits from Chuck Norris
481,"For Chuck Norris, NP-Hard = O(1)."
482,Chuck Norris knows the last digit of PI.
483,Bill Gates thinks he's Chuck Norris. Chuck Norris actually laughed. Once.
484,Chuck Norris is actually the front man for Apple. He let's Steve Jobs run the show when he's on a mission. Chuck Norris is always on a mission.
485,Chuck Norris' Internet connection is faster upstream than downstream because even data has more incentive to run from him than to him.
486,Chuck Norris solved the Travelling Salesman problem in O(1) time. Here's the pseudo-code: Break salesman into N pieces. Kick each piece to a different city.
487,No statement can catch the ChuckNorrisException.
488,Chuck Norris doesn't pair program.
489,Chuck Norris can write multi-threaded applications with a single thread.
490,Chuck Norris doesn't need to use AJAX because pages are too afraid to postback anyways.
491,"Chuck Norris doesn't use reflection, reflection asks politely for his help."
492,"There is no Esc key on Chuck Norris' keyboard, because no one escapes Chuck Norris."
493,Chuck Norris can binary search unsorted data.
494,Chuck Norris breaks RSA 128-bit encrypted codes in milliseconds.
495,"Chuck Norris doesn't needs try-catch, exceptions are too afraid to raise."
496,Chuck Norris went out of an infinite loop.
497,"If Chuck Norris writes code with bugs, the bugs fix themselves."
498,Chuck Norris hosting is 101% uptime guaranteed.
499,Chuck Norris's keyboard has the Any key.
500,Chuck Norris can access the DB from the UI.
501,"Chuck Norris' programs never exit, they terminate."
502,Chuck Norris insists on strongly-typed programming languages.
503,"Chuck Norris protocol design method has no status, requests or responses, only commands."
