504,"Chuck Norris programs occupy 150% of CPU, even when they are not executing."
505,Chuck Norris can spawn threads that complete before they are started.
506,Chuck Norris programs do not accept input.
507,Chuck Norris can install iTunes without installing Quicktime.
508,Chuck Norris doesn't need an OS.
509,Chuck Norris's OSI network model has only one layer - Physical.
510,Chuck Norris can compile syntax errors.
511,"Every SQL statement that Chuck Norris codes has an implicit ""COMMIT"" in its end."
512,Chuck Norris does not need to type-cast. The Chuck-Norris Compiler (CNC) sees through things. All way down. Always.
513,"Chuck Norris does not code in cycles, he codes in strikes."
514,Chuck Norris doesn't use a computer because a computer does everything slower than Chuck Norris.
515,Chuck Norris compresses his files by doing a flying round house kick to the hard drive.
517,Chick Norris solved the halting problem.
518,Chuck Norris doesn't cheat death. He wins fair and square.
519,Chuck Norris once one a game of connect four in 3 moves.
520,With Chuck Norris P = NP. There's no nondeterminism with Chuck Norris decisions.
521,Chuck Norris lost his virginity before his dad did.
522,Chuck Norris can do a wheelie on a unicycle.
523,Chuck Norris can win in a game of Russian roulette with a fully loaded gun.
524,Chuck Norris eats lightning and shits out thunder.
525,Chuck Norris can retrieve anything from /dev/null.
526,No one has ever pair-programmed with Chuck Norris and lived to tell about it.
527,No one has ever spoken during review of Chuck Norris' code and lived to tell about it.
528,"Chuck Norris doesn't use GUI, he prefers COMMAND line."
529,"Chuck Norris doesn't use Oracle, he is the Oracle."
530,Chuck Norris can dereference NULL.
531,"Jesus can walk on water, but Chuck Norris can swim through land."
532,A diff between your code and Chuck Norris's is infinite.
533,The Chuck Norris Eclipse plugin made alien contact.
534,"Chuck Norris is the ultimate mutex, all threads fear him."
535,Chuck Norris uses canvas in IE.
536,"Don't worry about tests, Chuck Norris's test cases cover your code too."
537,Each hair in Chuck Norris's beard contributes to make the world's largest DDOS.
538,Chuck Norris's log statements are always at the FATAL level.
539,"Chuck Norris's database has only one table, 'Kick', which he DROPs frequently."
540,Chuck Norris finished World of Warcraft.
541,"When Chuck Norris break the build, you can't fix it, because there is not a single line of code left."
542,Chuck Norris types with one finger. He points it at the keyboard and the keyboard does the rest.
543,Chuck Norris's programs can pass the Turing Test by staring at the interrogator.
544,"If you try to kill -9 Chuck Norris's programs, it backfires."
545,Chuck Norris's brain waves are suspected to be harmful to cell phones.
546,Chuck Norris does infinit loops in 4 seconds.
547,Product Owners never ask Chuck Norris for more features. They ask for mercy.
548,Product Owners never argue with Chuck Norris after he demonstrates the DropKick feature.
549,Chuck Norris killed two stones with one bird.
550,Chuck Norris can speak Braille.
551,Chuck Norris can over-write a locked variable.
552,"Chuck Norris knows the value of NULL, and he can sort by it too."
553,China lets Chuck Norris search for porn on Google.
554,Chuck Norris can install a 64 bit OS on 32 bit machines.
555,Chuck Norris doesn't have pubic hairs because hair doesn't grow on balls of steal.
556,Chuck Norris can write to an output stream.
557,Chuck Norris can read from an input stream.
558,Chuck Norris never has to build his program to machine code. Machines have learnt to interpret Chuck Norris code.
559,Chuck Norris' unit tests don't run. They die.
560,Chuck Norris sits at the stand-up.
561,Chuck Norris doesn't need an account. He just logs in.
562,"How many Chuck Norris require to screw a light bulb? None, he will screw it all."
563,Chuck Norris causes the Windows Blue Screen of Death.
564,Chuck Norris can download emails with his pick-up.
565,Chuck Norris can make a class that is both abstract and final.
566,"Chuck Norris could use anything in java.util.* to kill you, including the javadocs."
567,Code runs faster when Chuck Norris watches it.
584,"Only Chuck Norris shuts down websites without due process, not SOPA or PIPA."
